Company,company_number,sic_codes,Industry,start_index,end_index,sic_descriptions,title,Source Text,equity,employees,id,Risk Description,Risk Type,Risk Impact,Risk Summary,Pass,Risk Countries,Country Relevance,Postcode,Locality,European Electoral Region,Link,Date
HEALY GROUP LIMITED,8404317,['42990'],Construction,4449,5447,['Construction of other civil engineering projects nec'],Prod223_3666_08404317_20230630,"PRINCIPAL RISKS AND UNCERTAINTIES
The group's trading operations could be affected by a number of external factors that may pose a risk to its financial performance in the short, medium and long term which are: -

1. A significant downturn within the construction industry from external factors that are beyond the control of the group.

1. Uncapped price rises of general building materials resulted from supply and demand issues in particular as a result of continued global instability and conflict.

2. A change in Government following the imminent General Election which may result in a withdrawal of support for Stamp Duty Relief for first time buyers or changes to policies which support Housing Associations.

The directors continue to monitor the market conditions and meet regularly to discuss any foreseeable circumstances that may necessitate a change to the group's strategy in order to mitigate the business exposure to changes within the working environment.

ON BEHALF OF THE BOARD:",1924258.0,57,2805,Potential change in government following the General Election,Change in Government,Withdrawal of support for Stamp Duty Relief for first time buyers; Changes to policies which support Housing Associations,,TRUE,[],,B98 9HL,Redditch,West Midlands,https://find-and-update.company-information.service.gov.uk/company/08404317/filing-history/MzQxNjYxNzA5N2FkaXF6a2N4/document?format=xhtml&download=0,2024-03-29
L HEALY LIMITED,1719445,['42990'],Construction,4351,5305,['Construction of other civil engineering projects nec'],Prod223_3666_01719445_20230630,"3. A change in Government following the imminent General Election which may result in a withdrawal of support for Stamp Duty Relief for first time buyers or changes to policies which support Housing Associations.

The directors continue to monitor the market conditions and meet regularly to discuss any foreseeable circumstances that may necessitate a change to the company's strategy in order to mitigate the business exposure to changes within the working environment.

ON BEHALF OF THE BOARD:





R Healy - Director


29 March 2024

Page 3
L HEALY LIMITED (REGISTERED NUMBER: 01719445)

REPORT OF THE DIRECTORS
for the year ended 30 June 2023

The directors present their report with the financial statements of the company for the year ended 30 June 2023.

DIVIDENDS
No dividends were paid during the year (2022- nil).

DIRECTORS
The directors shown below have held office during the whole of the period from 1 July 2022 to the date of this report.",960557.0,57,29491,Potential change in government following the General Election,Change in Government,Withdrawal of support for Stamp Duty Relief for first time buyers; Changes to policies which support Housing Associations,,TRUE,[],,B98 9HL,Redditch,West Midlands,https://find-and-update.company-information.service.gov.uk/company/01719445/filing-history/MzQxNjYxMjI3MWFkaXF6a2N4/document?format=xhtml&download=0,2024-03-29
HILLSIDE MEDICAL SUPPLIES LIMITED,2623493,['47749'],Wholesale and Retail Trade; Repair of Motor Vehicles and Motorcycles,2183,3167,"['Retail sale of medical and orthopaedic goods (other than hearing aids) nec, in specialised stores']",Prod223_3666_02623493_20230630,"At the end of the financial year the company had gross assets of £819,002 (2022: £695,141) and net liabilities of £108,204 compared to net assets of £53,786 at 30 June 2022.
Principal risks and uncertainties
The principal risks and uncertainties affecting the company are:
- changes in health related government expenditure;
- competition in the market place;
- changes in dynamics and structures within the healthcare sector;
- disruption caused to IT and/or facilities that could disrupt the company’s supply chain;
- loss of key personnel;
- changes in distribution arrangements with suppliers.
Future developments
The directors have no plans to change the activities and operations of the company in the foreseeable future.
Research and development
The company did not engage in research and development activities during the financial period.
Page 2
  Hillside Medical Supplies Limited
Directors' Report for the Year Ended 30 June 2023
Directors and secretary and their interests",149296.0,4,34098,changes in health related government expenditure,Change in Government,,,TRUE,[],,OX16 3TB,Banbury,South East,https://find-and-update.company-information.service.gov.uk/company/02623493/filing-history/MzQxNjYxMjA3NGFkaXF6a2N4/document?format=xhtml&download=0,2024-03-29
ADAM BUCHANAN SMITH LIMITED,SC387609,['56103'],Accommodation and Food Service Activities,5274,6159,['Take away food shops and mobile food stands'],Prod223_3666_SC387609_20230331,"Regulatory risks
The company's operations demand a high level of compliance within a wide range of regulatory requirements. In particular -
* Health and safety
* Hygiene procedures
* Employment laws
* Licensing
The above, along with a number of other areas, are monitored in detail by McDonald's, as being in the fast food industry brings a high level of regulatory concerns.

Consumer taste
Any material changes in the way the consumer views the fast food industry could have an adverse effect on the company. However, this can also work in the opposite direction and could assist the company to achieve growth. As a result, the company focuses, in detail, on recognising demographic trends, ensuring innovation and the use of the freshest and highest quality products through its stores. The company has strict policies to ensure that all stores are maintaining the McDonald's ethos.",1388632.0,432,4188,High level of regulatory compliance required in fast-food industry,Emerging Regulation,,,TRUE,[],,FK14 7EA,Dollar,Scotland,https://find-and-update.company-information.service.gov.uk/company/SC387609/filing-history/MzQxNjYzMDAzNWFkaXF6a2N4/document?format=xhtml&download=0,2024-03-29
CARDIFF RUGBY LIMITED,3199030,['93120'],"Arts, Entertainment and Recreation",14453,15450,['Activities of sport clubs'],Prod223_3666_03199030_20230630,"As noted in last year’s financial report, the package related to the Revised Professional Rugby Agreement (RPRA), became effective in June 2023. As a part of that agreement, WRU Income has grown due to the inclusion for the first time of an allocation of the revenue from the transaction under which CVC acquired a proportion of the commercial rights to Six Nations matches. Further amounts will be distributed over the 6 year term of the RPRA financial plan. The Company also entered into a £3.75 million loan facility with the WRU which was drawn in July 2023, so will be recognised in Financial Year 2024. This facility has improved our short term financial position through enabling the payment of current creditors, whose support has been essential. However, as has been widely publicised, the RPRA imposes strict financial limits on Wales’ professional clubs including a salary cap of £4.5m. These strictures are necessary to service the capital and interest costs of the debt accumulated by",14323303.0,247,8089,Implementation of Revised Professional Rugby Agreement (RPRA),Emerging Regulation,RPRA imposes strict financial limits on Wales’ professional clubs including a salary cap of £4.5m,,TRUE,['Wales'],The risk refers to the Revised Professional Rugby Agreement (RPRA) which imposes financial limitations on Wales' professional rugby clubs. This is relevant as this agreement impacts Wales' allocation of revenue and overall financial standing within the rugby industry.,CF10 1JA,Cardiff,Wales,https://find-and-update.company-information.service.gov.uk/company/03199030/filing-history/MzQxNjQwMzg0N2FkaXF6a2N4/document?format=xhtml&download=0,2024-03-29
JACOBS & TURNER LIMITED,SC047678,"['46420', '47710']",Wholesale and Retail Trade; Repair of Motor Vehicles and Motorcycles,5526,6159,"['Wholesale of clothing and footwear', 'Retail sale of clothing in specialised stores']",Prod223_3666_SC047678_20230702,"Brexit risks: the group exports its goods to EU countries and is exposed in its trading operations to the effects of the UK leaving the EEC. An increased administration burden and an increase in duties having to be paid is impacting the profitability of Europe. The company continues to mitigate these but will be required to facilitate the increased documentation necessary to meet customs requirements to ensure the group's EU customers receive delivery of orders without undue delay. A key focus group has been put in place, to ensure that the risks are managed and that supplies get through to our customers and stores in Europe.",59263894.0,1616,20325,Increase in administration and duties due to Brexit,Emerging Regulation,"Reduction in profitability in Europe due to increased duties; Increased documentation necessary for customs requirements, increasing workload",,TRUE,"['Austria', 'Belgium', 'Bulgaria', 'Croatia', 'Republic of Cyprus', 'Czech Republic', 'Denmark', 'Estonia', 'Finland', 'France', 'Germany', 'Greece', 'Hungary', 'Ireland', 'Italy', 'Latvia', 'Lithuania', 'Luxembourg', 'Malta', 'Netherlands', 'Poland', 'Portugal', 'Romania', 'Slovakia', 'Slovenia', 'Spain', 'Sweden', 'Netherlands']",,G41 1LU,Kinning Park,Scotland,https://find-and-update.company-information.service.gov.uk/company/SC047678/filing-history/MzQxNjYxNTY5MmFkaXF6a2N4/document?format=xhtml&download=0,2024-03-29
TOZER SEEDS LIMITED,3627633,['96090'],Other Service Activities,3480,4401,['Other personal service activities nec'],Prod223_3666_03627633_20230630,"The business has experienced adverse effects following Brexit and we expect this to continue. The restrictions imposed on the UK’s access to the EU single market has impacted the revenue for the opportunities to grow the UK business and has made it considerably more difficult to export, however, this has been mitigated following the incorporation of our new subsidiary in the Netherlands and we expect to grow our European business through the new subsidiary.
Development and performance
Tozer continue to retain key staff in the research and development of our niche products, and the development of new varieties by investing in people, capital and infrastructure. The company has introduced a training and development programme for all staff, and an incentive scheme to ensure performance levels remain high and consistent across the business which includes staff in our global operations.
Key performance indicators",6059915.0,39,1608,Brexit and imposed restrictions to EU single market,Emerging Regulation,Impacted revenue opportunities for growing the UK business; Made it more difficult to export,,TRUE,"['Austria', 'Belgium', 'Bulgaria', 'Croatia', 'Republic of Cyprus', 'Czech Republic', 'Denmark', 'Estonia', 'Finland', 'France', 'Germany', 'Greece', 'Hungary', 'Ireland', 'Italy', 'Latvia', 'Lithuania', 'Luxembourg', 'Malta', 'Netherlands', 'Poland', 'Portugal', 'Romania', 'Slovakia', 'Slovenia', 'Spain', 'Sweden', 'Netherlands']","The risk involves the impacts of Brexit and the restrictions imposed on the UK's access to the 'EU single market'. The mentioned EU countries including Netherlands are impacted as the UK's trade relations with them are changed due to Brexit. Additionally, the company has developed a risk mitigation strategy that involves the incorporation of a subsidiary in the 'Netherlands'. This action directly relates these countries to the risk.",KT11 3EH,Cobham,South East,https://find-and-update.company-information.service.gov.uk/company/03627633/filing-history/MzQxNjYxMTA1MWFkaXF6a2N4/document?format=xhtml&download=0,2024-03-29
GREEKBEAT RADIO LIMITED,10265190,['73120'],"Professional, Scientific and Technical Activities",12130,13053,['Media representation'],Prod223_3666_10265190_20230331,"Despite the fact that our organisation offers community radio station services, we are always considering the environmental sustainability. Future business performance will be impacted by our ability to effectively manage the transition to a low carbon economy balancing commercial decisions with the environmental responsibility, agreeing business-wide decarbonisation priorities, and managing changes in customer preferences.

This includes management of the increasing costs associated with sustainable materials, recycling carbon pricing and further technological, policy and regulatory interventions.

We are operating in a world and a sector with high pressure from carbon-conscious customers, government bodies and regulators to operate in a more environmentally conscious manner. To respond to the circular economy, waste reduction and low carbon products and use of a recycled parts and related components.

Page 6",17541.0,1,22836,Transition to low carbon economy and adapting to environmental regulations,Emerging Regulation,Increasing costs associated with sustainable materials; Carbon pricing and further technological challenges; Policy and regulatory interventions; Pressure to operate in a more environmentally conscious manner; Adapting to a circular economy; Waste reduction and low carbon products; Utilization of recycled parts and related components,,TRUE,[],,,Potters Bar,,https://find-and-update.company-information.service.gov.uk/company/10265190/filing-history/MzQxNjU5OTQzM2FkaXF6a2N4/document?format=xhtml&download=0,2024-03-29
KILNBRIDGE GROUP LIMITED,2846010,['64203'],Financial and Insurance Activities,35081,35972,['Activities of construction holding companies'],Prod223_3666_02846010_20230630,"We continue to invest in new plant and equipment technologies to meet the needs of the business’s innovative construction methods and to improve project performance in terms of sustainability, programme, and cost. This includes, use of electric plant to reduce CO2 emissions on our project sites, inclusion of electric vehicles in our group car fleet and using REGO-backed renewable energy sources.
In 2023, we set a Carbon Reduction Plan (PPN 06/21) which aims to reduce our carbon emission both in absolute terms and intensity. 
Kilnbridge’s carbon intensity has reduced by 30% since FY2021 but rose 21% between FY2022 and FY2023. The main reason for this is the Government’s reform of rebated fuels entitlement that came into effect from April 2022, which resulted in the price of HVO fuel averaging 10% to 20% more than standard diesel, impacting our direct impact carbon emissions data.",21179989.0,4,1469,"Government reform increased the price of HVO fuel, which is more costly than standard diesel.",Emerging Regulation,Increased fuel costs; Increase in the company's carbon emissions,,TRUE,[],,E16 4TL,London,London,https://find-and-update.company-information.service.gov.uk/company/02846010/filing-history/MzQxNjYzMDc4MmFkaXF6a2N4/document?format=xhtml&download=0,2024-03-29
NG INVESTMENTS LIMITED,7996525,['64203'],Financial and Insurance Activities,36511,37402,['Activities of construction holding companies'],Prod223_3666_07996525_20230630,"We continue to invest in new plant and equipment technologies to meet the needs of the business’s innovative construction methods and to improve project performance in terms of sustainability, programme, and cost. This includes, use of electric plant to reduce CO2 emissions on our project sites, inclusion of electric vehicles in our group car fleet and using REGO-backed renewable energy sources.
In 2023, we set a Carbon Reduction Plan (PPN 06/21) which aims to reduce our carbon emission both in absolute terms and intensity. 
Kilnbridge’s carbon intensity has reduced by 30% since FY2021 but rose 21% between FY2022 and FY2023. The main reason for this is the Government’s reform of rebated fuels entitlement that came into effect from April 2022, which resulted in the price of HVO fuel averaging 10% to 20% more than standard diesel, impacting our direct impact carbon emissions data.",19746362.0,3,14077,Government's reform of rebated fuels entitlement,Emerging Regulation,Increased cost of HVO fuel leading to increased project costs; Increase in carbon emissions despite previously implemented Carbon Reduction Plan,,TRUE,[],,E16 4TL,London,London,https://find-and-update.company-information.service.gov.uk/company/07996525/filing-history/MzQxNjYyNTkxMGFkaXF6a2N4/document?format=xhtml&download=0,2024-03-29
STRATHMORE HOTELS (SCOTLAND) LIMITED,SC225775,['55100'],Accommodation and Food Service Activities,8486,9160,['Hotels and similar accommodation'],Prod223_3666_SC225775_20221231,"DIRECTORS' REPORT (CONTINUED)
FOR THE YEAR ENDED 31 DECEMBER 2022
- 4 -
Energy and carbon report
From financial years beginning after 1 April 2019, large UK companies are required to report publicly on their global energy use and carbon emissions within their Directors’ Report. Although the company's subsidiary undertaking is eligible to make the necessary disclosures, exemption has been taken from including the disclosures within these financial statements as Strathmore Hotels (Scotland) Limited is itself a subsidiary undertaking of Strathmore Leisure Limited and the relevant disclosures are made within those financial statements.
Statement of disclosure to auditor",13257585.0,4,33531,New reporting requirements on energy use and carbon emissions,Emerging Regulation,,,TRUE,[],,G74 1LF,Lanarkshire,Scotland,https://find-and-update.company-information.service.gov.uk/company/SC225775/filing-history/MzQxNjYyMjk0OWFkaXF6a2N4/document?format=xhtml&download=0,2024-03-29
JACOBS & TURNER LIMITED,SC047678,"['46420', '47710']",Wholesale and Retail Trade; Repair of Motor Vehicles and Motorcycles,4628,5524,"['Wholesale of clothing and footwear', 'Retail sale of clothing in specialised stores']",Prod223_3666_SC047678_20230702,"Credit risks: the group's main credit risk is attributable to its trade debtors. The group maintains a strong relationship with each of its key customers and has established credit control parameters. Appropriate credit terms are agreed with all customers, and these are closely managed. The group ‘s exposure to credit risk is spread over many customers.
JACOBS & TURNER LIMITED
STRATEGIC REPORT (CONTINUED)
FOR THE PERIOD ENDED 2 JULY 2023
- 2 -
Principal risks and uncertainties (continued)
Shipping risks: the group imports its goods from East Asia and is exposed to geopolitical threats to key shipping routes, an increase in shipping costs and potential delays in the shipment of goods. The group is managing this risk through regular collaboration with its suppliers, as well as looking at dual sourcing in other parts of the globe to help manage the risk of the increased transport costs.",59263894.0,1616,20324,"Exposure to geopolitical threats to key shipping routes, an increase in shipping costs, and potential delays in the shipment of goods",Logistics Restrictions,Regular collaboration with suppliers; Potential for dual sourcing of goods from other parts of the globe to help manage the risk of the increased transport costs,,TRUE,"['China', 'Mongolia', 'North Korea', 'South Korea', 'Japan', 'Taiwan']","The group imports its goods from these countries in East Asia. Hence, they are exposed to geopolitical threats to key shipping routes, an increase in shipping costs, and potential delays in the shipment of goods.",G41 1LU,Kinning Park,Scotland,https://find-and-update.company-information.service.gov.uk/company/SC047678/filing-history/MzQxNjYxNTY5MmFkaXF6a2N4/document?format=xhtml&download=0,2024-03-29
JACOBS & TURNER LIMITED,SC047678,"['46420', '47710']",Wholesale and Retail Trade; Repair of Motor Vehicles and Motorcycles,5526,6159,"['Wholesale of clothing and footwear', 'Retail sale of clothing in specialised stores']",Prod223_3666_SC047678_20230702,"Brexit risks: the group exports its goods to EU countries and is exposed in its trading operations to the effects of the UK leaving the EEC. An increased administration burden and an increase in duties having to be paid is impacting the profitability of Europe. The company continues to mitigate these but will be required to facilitate the increased documentation necessary to meet customs requirements to ensure the group's EU customers receive delivery of orders without undue delay. A key focus group has been put in place, to ensure that the risks are managed and that supplies get through to our customers and stores in Europe.",59263894.0,1616,20325,Increased administration and duties due to Brexit,Logistics Restrictions,"Decrease in profitability in Europe; Requirement for increased documentation to meet customs requirements, potentially slowing delivery of orders; Increased burden on management to ensure supplies reach customers and stores in Europe without interruption",,TRUE,"['Austria', 'Belgium', 'Bulgaria', 'Croatia', 'Republic of Cyprus', 'Czech Republic', 'Denmark', 'Estonia', 'Finland', 'France', 'Germany', 'Greece', 'Hungary', 'Ireland', 'Italy', 'Latvia', 'Lithuania', 'Luxembourg', 'Malta', 'Netherlands', 'Poland', 'Portugal', 'Romania', 'Slovakia', 'Slovenia', 'Spain', 'Sweden']","These countries are part of the European Union (EU) to which the group exports goods. The risk specifies the impacts of increased administration and duties due to Brexit, which directly affects the group's trading operations with these countries. The increased administration burden and an increase in duties that the company has to bear might impact its profitability in these regions.",G41 1LU,Kinning Park,Scotland,https://find-and-update.company-information.service.gov.uk/company/SC047678/filing-history/MzQxNjYxNTY5MmFkaXF6a2N4/document?format=xhtml&download=0,2024-03-29
VIDI CONSTRUCTION LTD,9961909,"['41202', '71111']","Professional, Scientific and Technical Activities",2854,3630,"['Construction of domestic buildings', 'Architectural activities']",Prod223_3666_09961909_20230331,"- The initial impact of BREXIT and global disruption was still being felt throughout the business with pressures on resource availability and procurement costs. Whilst we believe we have managed the inflationary pressures well; it has inevitably affected profitability.

- As a result of COVID and BREXIT, the resilience within the industry is being challenged. We have seen the demise of a number of sub-contractors during the past year and this has presented further challenges in the completion of projects.

- The unpredictable increase in the price of materials has had impact on the profitability of the project, and was exacerbated by the impacts of the Ukraine-Russian war which disrupted the trade routes with our suppliers leading to further delays and higher costs.",3552460.0,40,12002,"Disruption due to BREXIT, COVID-19, and Ukraine-Russian war",Logistics Restrictions,Reduced profitability due to inflationary pressures; Demise of sub-contractors causing challenges in project completion; Unpredictable increase in materials' price affecting project profitability; Delays and higher costs due to disrupted trade routes,,TRUE,"['Ukraine', 'Russia']","The Ukraine-Russian war has disrupted the trade routes with the company's suppliers, causing higher costs and delays, and thereby affecting the company's profitability.",CV1 4PB,Coventry,West Midlands,https://find-and-update.company-information.service.gov.uk/company/09961909/filing-history/MzQxNjYyNzM2OGFkaXF6a2N4/document?format=xhtml&download=0,2024-03-29
