Company,company_number,sic_codes,Industry,start_index,end_index,sic_descriptions,title,Source Text,equity,employees,id,Risk Description,Risk Type,Risk Impact,Risk Summary,Pass,Risk Countries,Country Relevance,Postcode,Locality,European Electoral Region,Link,Date
ARMATILE LIMITED,NI018558,['47530'],Wholesale and Retail Trade; Repair of Motor Vehicles and Motorcycles,3477,4463,"['Retail sale of carpets, rugs, wall and floor coverings in specialised stores']",Prod223_3666_NI018558_20230630,"The company has implemented policies that require appropriate credit checks on potential customers before sales are made. The amount of exposure is constantly reviewed.
Brexit
The company also has exposure to the impact of Brexit and the free trade agreement negotiated between the UK and the European Union. The implementation of the Northern Ireland protocol which aims to avoid the introduction of a hard border on the island of Ireland has not had a material impact on the supply of goods from GB. The directors are constantly monitoring this area to manage the exposure of the company.
This report was approved by the board of directors on 29 March 2024 and signed on behalf of the board by:
Mr Conor Moore
Director
Armatile Limited
Directors report
Year ended 30 June 2023
The directors present their report and the financial statements of the company for the year ended 30 June 2023.
Directors
The directors who served the company during the year were as follows:
Mr James McCann",7629081.0,86,6245,Impact of Brexit and the free trade agreement between the UK and EU,Logistics Restrictions,Unpredictable supply of goods from GB; Constant monitoring and management of company exposure necessary,,TRUE,"['United Kingdom', 'Austria', 'Belgium', 'Bulgaria', 'Croatia', 'Republic of Cyprus', 'Czech Republic', 'Denmark', 'Estonia', 'Finland', 'France', 'Germany', 'Greece', 'Hungary', 'Ireland', 'Italy', 'Latvia', 'Lithuania', 'Luxembourg', 'Malta', 'Netherlands', 'Poland', 'Portugal', 'Romania', 'Slovakia', 'Slovenia', 'Spain', 'Sweden']","The risk is connected to the impact of Brexit and the free trade agreement between the UK and the EU. With Brexit, the UK has exited the EU, affecting the trade relations between the UK and EU member states. The implementation of the Northern Ireland protocol, aiming to avoid the introduction of a hard border on the island of Ireland, also constitutes a part of this risk.",BT61 7NP,Armagh,Northern Ireland,https://find-and-update.company-information.service.gov.uk/company/NI018558/filing-history/MzQxNjYwNzY3OGFkaXF6a2N4/document?format=xhtml&download=0,2024-03-29
GREEKBEAT RADIO LIMITED,10265190,['73120'],"Professional, Scientific and Technical Activities",8404,9342,['Media representation'],Prod223_3666_10265190_20230331,"11. EVENTS AFTER THE REPORTING PERIOD

There were no essential either adjusting events or non-adjusting events in the period of time elapsing between the balance sheet date and the date on which these financial statements are prepared. The impact of COVID-19 is described in the Going Concern Consideration Note.
The ongoing Russia-Ukraine conflict has resulted in going concern becoming a significant risk. The United States and Europe have avoided direct military conflict with Russia amid its conflict with Ukraine. They have however used a set of financial sanctions to limit Russia's access to financial resources. The impact of the sanctions may result in difficulties for the company to operate. Neither Greekbeat Radio Limited nor the owners are currently on the sanctions list at the time of this report, however this may change as the situation changes.

Page 5 continued...
Greekbeat Radio Limited (Registered number: 10265190)",17541.0,1,22831,Potential inclusion in sanctions list due to ongoing Russia-Ukraine conflict,Sanctions,Difficulty for the company to operate; Potential impact on 'going concern' status due to uncertainty,,TRUE,"['Russia', 'Ukraine', 'United States of America']","The ongoing military conflict between Russia and Ukraine has led the United States and Europe to implement financial sanctions against Russia. Due to this, there's a potential risk of the company being added into the sanctions list which could limit their access to financial resources.",,Potters Bar,,https://find-and-update.company-information.service.gov.uk/company/10265190/filing-history/MzQxNjU5OTQzM2FkaXF6a2N4/document?format=xhtml&download=0,2024-03-29
JK TECH UK LIMITED,3812106,['62090'],[None],36524,37481,['Other information technology and computer service activities'],Prod223_3666_03812106_20230331,"There were no essential either adjusting events or non-adjusting events in the period of time elapsing between the balance sheet date and the date on which these financial statements are prepared.The directors have also confirmed that the business will continue to be a going concern for the foreseeable future and they will support the company.
The Ongoing Russia – Ukraine conflict
This ongoing Russia - Ukraine conflict has resulted in going concern becoming a significant risk. The United States and Europe have avoided direct military conflict with Russia amid its conflict with Ukraine. They have however used a set of financial sanctions to limit Russia's access to financial resources. The impact of the sanctions may result in difficulties for the company to operate.Neither JK Tech UK Limited nor the owners are currently on the sanctions list at the time of this report, however this may change as the situation changes.
13 Contingent liabilities",637543.0,13,11956,Ongoing Russia-Ukraine conflict and associated sanctions,Sanctions,Going concern risk associated with the potential of being placed on the sanctions list; Future operational difficulties due to sanctions,,TRUE,"['Russia', 'Ukraine', 'United States']","Russia and Ukraine are directly involved in the ongoing conflict which is the identified risk. The United States is mentioned with direct relevance to economic sanctions on Russia, which is a key element of this risk as it may result in difficulties for the company to operate.",W1W 7LT,London,London,https://find-and-update.company-information.service.gov.uk/company/03812106/filing-history/MzQxNjY0NTEwOGFkaXF6a2N4/document?format=xhtml&download=0,2024-03-29
JK TECH UK LIMITED,3812106,['62090'],[None],1597,2589,['Other information technology and computer service activities'],Prod223_3666_03812106_20230331,"a.This ongoing Russia - Ukraine conflict has resulted in going concern becoming a significant risk. The United States and Europe have avoided direct military conflict with Russia amid its conflict with Ukraine. They have however used a set of financial sanctions to limit Russia's access to financial resources. The impact of the sanctions may result in difficulties for the company to operate. Neither JK Tech UK Limited nor the owners are currently on the sanctions list at the time of this report, however this may change as the situation changes.
b. Financial risk management objectives and policies of the company including the policy for hedging each major type of forecasted transaction for which hedge accounting is used ;and
c. The exposure of the company to price risk,credit risk,liquidity risk and cash flow risk;unless such information is not material for the assessment of the assets ,liabilities,financial position and profit or loss of the company.
Directors' responsibilities",637543.0,13,11911,Ongoing Russia-Ukraine conflict and subsequent financial sanctions impacting company operations.,Sanctions,Difficulty for the company to operate due to financial sanctions; Potential risk of being placed on sanctions list in the future due to evolving geopolitical situation.,,TRUE,"['Russia', 'Ukraine']","The ongoing conflict between Russia and Ukraine, along with subsequent financial sanctions, is posing a significant risk to the company's operations. The sanctions imposed as a response to the conflict may limit the company's access to financial resources.",W1W 7LT,London,London,https://find-and-update.company-information.service.gov.uk/company/03812106/filing-history/MzQxNjY0NTEwOGFkaXF6a2N4/document?format=xhtml&download=0,2024-03-29
HIGH ROAD RESTAURANTS GROUP HOLDCO LIMITED,10482231,['64209'],Financial and Insurance Activities,7302,7518,"['Activities of other holding companies (not including agricultural, production, construction, distribution and financial services holding companies) nec']",Prod223_3666_10482231_20230625,"The recent closures of certain restaurants, together with the rise in minimum wage, has eased the recruitment issue to some extent, but staff recruitment remains a challenge for the group and the industry as a whole.",3811844.0,312,35920,Struggle in employee recruitment aggravated by minimum wage increase,Minimum Wage Hike,Continued difficulty in workforce recruitment; Industry-wide recruitment issues,,TRUE,[],,RH4 3BX,Dorking,South East,https://find-and-update.company-information.service.gov.uk/company/10482231/filing-history/MzQxNjYyNjU3NmFkaXF6a2N4/document?format=xhtml&download=0,2024-03-29
BRUCE GROUP SCOTLAND LIMITED,SC236976,['56302'],Accommodation and Food Service Activities,1645,2556,['Public houses and bars'],Prod223_3666_SC236976_20230630,"The year started free of the Covid-19 trading restrictions and the random disruption which had followed on from the initial Covid lockdown in March 2020. The return to normal trading, coupled with pent up demand which had built up through the lockdowns and restricted openings, saw turnover in excess of pre-Covid levels. Tourists started to return to the city and the Edinburgh Fringe also opened back up in Autumn 2022 which all contributed to a buoyant trading environment.

Turnover was further enhanced as Bruce Investments Ltd started trading, after the successful acquisition of the Drovers Inn in July 2022.

However, there were were also significant inflationary pressures on costs. Food and energy prices were both driven up by the war in Ukraine, whilst labour costs were pushed higher by increases in the national minimum wage, which started our year at £9.50 and closed at £10.42 - a 9.7% increase.",103045.0,301,2321,"Increase in the national minimum wage, which rose 9.7%",Minimum Wage Hike,Heightened labor costs; Inflationary pressures on the company's operating costs,,TRUE,[],,FK7 9JQ,Stirling,Scotland,https://find-and-update.company-information.service.gov.uk/company/SC236976/filing-history/MzQxNjYyNDI1M2FkaXF6a2N4/document?format=xhtml&download=0,2024-03-29
DINA FOODS LIMITED,2651200,['10710'],Manufacturing,6480,7479,['Manufacture of bread; manufacture of fresh pastry goods and cakes'],Prod223_3666_02651200_20230630,"results in a slightly lower gross profit ratio of 28.7% as compared to the company's norm over
30% and previous years 31.5% ratios
Key Performance Indicators (KPI's)
The Board monitors the progress of the Company by reference to the following KPI's.
The figures indicate a drop in the key performance ratios, however these are expected by the
directors due to continued increases in minimum wage and overheads
2023 2022
Gross profit ratio 28.68% 31.51%
Net profit ratio 2.18% 2.13%
Return on capital employed 16.04% 13.39%
Sale and Marketing
The top ten customers of the business account for over 60% of the total sales indicating our
deeper penetration and wider distribution within the key grocery market sector
Export remains one of he important and strategic targets for the company's current and future
growth potential, currently contributing over 30% if the confectionary business and close to 14%
of Private labels especially within the ""Food to go"" and ""Sandwich making"" growth markets, are",6913280.0,196,37699,Increasing minimum wage.,Minimum Wage Hike,Lower gross profit ratio.; An overall drop in key performance ratios.,,TRUE,[],,SE15 3LS,,London,https://find-and-update.company-information.service.gov.uk/company/02651200/filing-history/MzQxNjU4NDMxMGFkaXF6a2N4/document?format=xhtml&download=0,2024-03-29
TGC (2015) LIMITED,9409991,['47760'],Wholesale and Retail Trade; Repair of Motor Vehicles and Motorcycles,6768,7752,"['Retail sale of flowers, plants, seeds, fertilisers, pet animals and pet food in specialised stores']",Prod223_3666_09409991_20230630,"Staff costs remain a significant concern for the business with another significant rise in National Living Wage due in April 2024. In July 2023, actions were taken to reduce staff costs at Tingley to reflect the lower than expected level of sales. Furthermore, in February 2024, the Directors have taken corrective action through a reduction to working hours across all areas of the business, in order to offset some of the near 10% rise in National Living Wage in April. This will save c.£0.5m on an annualised basis.

We monitor the Bank of England base rate closely and hedge debt as appropriate, in order to balance the twin objectives of minimising exposure to market volatility and also minimising overall interest cost. We currently have a mix of hedged and unhedged debt.

We closely monitor foreign currency fluctuations and manage risk accordingly, albeit foreign currency purchases are not material to the business.


Page 3
TGC (2015) Limited (Registered number: 09409991)",6791128.0,412,28553,anticipated increase in National Living Wage in April 2024,Minimum Wage Hike,"Requirement for corrective actions such as reduction in working hours across all business areas to offset wage hike, affecting company operations",,TRUE,[],,BD4 0RY,Bradford,Yorkshire and The Humber,https://find-and-update.company-information.service.gov.uk/company/09409991/filing-history/MzQxNjYyODczOGFkaXF6a2N4/document?format=xhtml&download=0,2024-03-29
BUILDING AND PLUMBING SUPPLIES LIMITED,288407,['46130'],Wholesale and Retail Trade; Repair of Motor Vehicles and Motorcycles,2942,3937,['Agents involved in the sale of timber and building materials'],Prod223_3666_00288407_20230630,"The period has seen continuing supply chain management impact and price volatility from the ongoing war in Ukraine, continuing fuel price volatility, 2 substantial national living wage rises, rising Bank of England Base Rate and these factors combining to cause a cost of living crisis for some, tempering demand from others. Considering the overall net trading loss despite strong margins and the overall business conditions at the end of the period as confirmed by BMF and other industry data, the board has instigated a strategic review. All aspects of the business have been subject to this review with a focus on maintaining high levels of customer service, providing optimal product ranges, replacing and streamlining where appropriate as well as introducing new software and reporting structures to support greater control, efficiency and responsiveness. The business continues to prioritise providing a good working environment for its valued staff enabling skills development and career",9653262.0,129,5942,challenged by two substantial increases in the national living wage,Minimum Wage Hike,A net trading loss despite strong margins due to the combined impact of various factors including the wage increases,,TRUE,[],,CV34 6RH,Leamington Spa,West Midlands,https://find-and-update.company-information.service.gov.uk/company/00288407/filing-history/MzQxNjYyMDM1NGFkaXF6a2N4/document?format=xhtml&download=0,2024-03-29
HIGH ROAD RESTAURANTS GROUP HOLDCO LIMITED,10482231,['64209'],Financial and Insurance Activities,6400,7300,"['Activities of other holding companies (not including agricultural, production, construction, distribution and financial services holding companies) nec']",Prod223_3666_10482231_20230625,"Having considered the trading performance of the group subsequent to the year end, the extension (in October 2023) of loan note repayment terms provided by investors and the forecasts prepared for a period to June 2025 and considered a period of at least 12 months from the date of approval of these financial statements (in light of the principal risks and uncertainties described below in the context of the negative balance sheet position), the directors are satisfied that the going concern basis of preparation remains appropriate.
Principal risks and uncertainties
Staff shortages
Following the UK’s decision to leave the EU, staff recruitment has been a major issue and concern facing the leisure sector. Following the covid outbreak, European nationals left the UK workforce to stay with their families. Brexit and the resulting visa restrictions has ensured that many of them never returned.",3811844.0,312,35919,European staff shortages due to Brexit and visa restrictions,Talent Availability,,,TRUE,"['United Kingdom', 'Austria', 'Belgium', 'Bulgaria', 'Croatia', 'Republic of Cyprus', 'Czech Republic', 'Denmark', 'Estonia', 'Finland', 'France', 'Germany', 'Greece', 'Hungary', 'Ireland', 'Italy', 'Latvia', 'Lithuania', 'Luxembourg', 'Malta', 'Netherlands', 'Poland', 'Portugal', 'Romania', 'Slovakia', 'Slovenia', 'Spain', 'Sweden']",The risk is directly related to the United Kingdom as it experiences staff shortages due to the country's decision to leave the EU and the resultant visa restrictions.,RH4 3BX,Dorking,South East,https://find-and-update.company-information.service.gov.uk/company/10482231/filing-history/MzQxNjYyNjU3NmFkaXF6a2N4/document?format=xhtml&download=0,2024-03-29
KILNBRIDGE GROUP LIMITED,2846010,['64203'],Financial and Insurance Activities,15655,16641,['Activities of construction holding companies'],Prod223_3666_02846010_20230630,"until September 2024.
 The procurement department is responsible
for managing suppliers. During the year
the department focused on
bulk purchasing where possible to
benefit from preferential price, and
forward purchasing materials
and increasing the amount of stock held
in order to mitigate future price increases.
Increased competition for skilled labour
An ongoing shortage of skilled and semi-skilled labour in the construction industry has the potential to impact on the delivery of our contractual obligations.
  Providing training and development to our
own staff to upskill employees and fill
roles internally
 Sponsoring apprentices to create a
new generation of skilled workers
 Reviewing and benchmarking our pay and
benefits packages to make them more
competitive
 All staff who work at Kilnbridge join
the employee owned trust and are eligible
for a share of profit-related bonuses.
 Using skilled worker licences to recruit
from overseas where required.
Financial controls",21179989.0,4,1447,Shortage of skilled and semi-skilled labour in the construction industry,Talent Availability,Potential impact on the delivery of contractual obligations,,TRUE,[],,E16 4TL,London,London,https://find-and-update.company-information.service.gov.uk/company/02846010/filing-history/MzQxNjYzMDc4MmFkaXF6a2N4/document?format=xhtml&download=0,2024-03-29
NG INVESTMENTS LIMITED,7996525,['64203'],Financial and Insurance Activities,16649,17641,['Activities of construction holding companies'],Prod223_3666_07996525_20230630,"Mitigating controls
Price inflation
Inflationary pressures have an impact on input prices including labour, materials and energy.
  Inflation recovery mechanisms are built into
contracts.
 Front-line staff costs are directly related to
client contracts and are covered by price
adjustment factors.
 Head office energy contracts are fixed
until September 2024.
 The procurement department is responsible
for managing suppliers. During the year
the department focused on
bulk purchasing where possible to
benefit from preferential price, and
forward purchasing materials
and increasing the amount of stock held
in order to mitigate future price increases.
Increased competition for skilled labour
An ongoing shortage of skilled and semi-skilled labour in the construction industry has the potential to impact on the delivery of our contractual obligations.
  Providing training and development to our
own staff to upskill employees and fill
roles internally.
 Sponsoring apprentices to create a",19746362.0,3,14054,Ongoing shortage of skilled and semi-skilled labour in the construction industry,Talent Availability,Potential impact on the delivery of contractual obligations,,TRUE,[],,E16 4TL,London,London,https://find-and-update.company-information.service.gov.uk/company/07996525/filing-history/MzQxNjYyNTkxMGFkaXF6a2N4/document?format=xhtml&download=0,2024-03-29
EXPRESS DISTRIBUTION SERVICES LTD,NI033129,['53201'],Transportation and Storage,25030,25886,['Licensed Carriers'],Prod223_3666_NI033129_20231031,"The director have identified the following areas of risk and uncertainty Environment The company recognises its corporate responsibility to carry out its operations whilst minimising environmental impacts. The director's continued aim is to comply with all applicable environmental legislation, prevent pollution and reduce waste wherever possible. Health and safety The company is committed to achieving the highest practicable standards in health and safety management and strives to make all premises safe environments for employees and customers alike. Employees The director recognises the importance of the recruitment, training and retention of a highly skilled and motivated work force. There is a risk that future growth could be impeded due to lack of skilled resources. This risk is being addressed through internal training.
Revenue recognition",4608660.0,80,15379,Lack of skilled resources for future growth,Talent Availability,Potential obstruction to future growth,,TRUE,[],,BT66 6SY,Craigavon,Northern Ireland,https://find-and-update.company-information.service.gov.uk/company/NI033129/filing-history/MzQxNjYxODI1OGFkaXF6a2N4/document?format=xhtml&download=0,2024-03-29
VIDI CONSTRUCTION LTD,9961909,"['41202', '71111']","Professional, Scientific and Technical Activities",12659,13606,"['Construction of domestic buildings', 'Architectural activities']",Prod223_3666_09961909_20230331,"The main risk is a failure to attract and retain key employees. The construction industry as a whole is at risk of an ageing workforce and a lack of skilled workers. The business invests to enable staff to obtain the necessary skills and qualifications to perform their duties with a mixture of internal and external courses. This company is fortunate to have very loyal, committed and very hard working workforce.

Cyber security

The board have a mixture of robust procedures, IT infrastructure and insurance in place to help mitigate this risk, by protection of infrastructure from current conventional cyber/loss of data risks.

Potential impact include reputational damage, regulatory fines/prosecutions and operational impacts such as loss of confidential data and key system outages.

To mitigate this, there are mandatory staff trainings to raise awareness, system alerts and data loss prevention tools in place.

Financial Risk Management",3552460.0,40,12013,Failure to attract and retain key employees due to an ageing workforce and lack of skilled workers.,Talent Availability,Increased investment to train staff,,TRUE,[],,CV1 4PB,Coventry,West Midlands,https://find-and-update.company-information.service.gov.uk/company/09961909/filing-history/MzQxNjYyNzM2OGFkaXF6a2N4/document?format=xhtml&download=0,2024-03-29
THE UIST COMMUNITY RIDING SCHOOL,SC187242,['93199'],"Arts, Entertainment and Recreation",2177,3072,['Other sports activities (not including activities of racehorse owners) nec'],Prod223_3666_SC187242_20230630,"FINANCIAL REVIEW
Principal funding sources
The year to end June 2023 has been an encouraging year with our new yard manager taking the helm to promote and enhance the club which in turn has assisted us in gaining new and returnee riders, of all ages and abilities, whom many of which are becoming regulars. This has resulted in us being able to maximise revenue opportunities with a welcomed increase in trade which has been aided also by the increasing amount of visitors to the Island using our facilities.

This year has not gone by without its challenges mainly due to the weather conditions we have experienced resulting in us not being able to utilise the outdoors or the school for part of year up until the roof was replace in November 2022. We are grateful to all who assist us in getting to the stage of being able to fully replace our school roof just in time for heading into winter.",,4,7559,Extreme weather conditions preventing outdoor activities and damaging the school roof,Extreme Weather,Inability to utilize outdoor spaces for part of the year; Damage to the school roof requiring replacement,,TRUE,[],,HS7 5LA,Isle Of Benbecula,Scotland,https://find-and-update.company-information.service.gov.uk/company/SC187242/filing-history/MzQxNjYyNzU4N2FkaXF6a2N4/document?format=xhtml&download=0,2024-03-29
