Company,company_number,sic_codes,Industry,start_index,end_index,sic_descriptions,title,Source Text,equity,employees,id,Risk Description,Risk Type,Risk Impact,Risk Summary,Pass,Risk Countries,Country Relevance,Postcode,Locality,European Electoral Region,Link,Date
HBS GROUP SOUTHERN LTD,2104036,['43220'],Construction,1724,2392,"['Plumbing, heat and air-conditioning installation']",Prod223_3666_02104036_20230331,"Coming out of the pandemic, HBS had a strong pipeline of work to deliver which unfortunately did not materialise into profit as material prices increase went up an exceptional amount almost on a monthly basis, significantly impacting gross profit. This was exacerbated by the war in Ukraine which is having a knock on impact on the energy crisis, increasing costs for the manufacturers, further impacting the cost of living in the UK, the uncertainty in interest rates and volatility in material supply chain availability and pricing, this however has now been significantly mitigated for future works due to change in process and instruction from the management team.",5603174.0,78,27883,War in Ukraine,Interstate Conflict,exacerbating energy crisis and volatility in material supply chain availability and pricing; increased manufacturing costs; significantly impacted gross profit; uncertainty in interest rates; increased cost of living in the UK,,TRUE,['Ukraine'],The war in Ukraine is exacerbating the energy crisis and causing volatility in the material supply chain availability and pricing. This directly contributes to the risks faced by the company.,PO15 7FE,Whiteley,South East,https://find-and-update.company-information.service.gov.uk/company/02104036/filing-history/MzQxNjYzMDMxNmFkaXF6a2N4/document?format=xhtml&download=0,2024-03-29
BRUCE GROUP SCOTLAND LIMITED,SC236976,['56302'],Accommodation and Food Service Activities,4051,4731,['Public houses and bars'],Prod223_3666_SC236976_20230630,"The group made an operating profit of £1,945,177 for the year. This was £161,196 down on the prior year. The acquisition of the Drovers and its inclusion in the group results helped mitigate some of the adverse impacts of cost increases.Gross profit margins were eroded due to increases in labour and food and drink costs, whilst overheads were impacted as Covid 19 rates relief support ended in the year to 30th June 2022 and utility bills increased substantially as a result of the war in Ukraine.

EBITDA (excluding the impact of investment property revaluations) fell to £2,258,011 (2022 : £2,410,063). Excluding the impact of the Drovers, like for like EBITDA was £1,995,566.",103045.0,301,2324,War in Ukraine ,Interstate Conflict,Substantial increase in utility bills,,TRUE,['Ukraine'],"The war in Ukraine is leading to a significant increase in utility bills, causing a risk for the firm.",FK7 9JQ,Stirling,Scotland,https://find-and-update.company-information.service.gov.uk/company/SC236976/filing-history/MzQxNjYyNDI1M2FkaXF6a2N4/document?format=xhtml&download=0,2024-03-29
VIDI CONSTRUCTION LTD,9961909,"['41202', '71111']","Professional, Scientific and Technical Activities",2854,3630,"['Construction of domestic buildings', 'Architectural activities']",Prod223_3666_09961909_20230331,"- The initial impact of BREXIT and global disruption was still being felt throughout the business with pressures on resource availability and procurement costs. Whilst we believe we have managed the inflationary pressures well; it has inevitably affected profitability.

- As a result of COVID and BREXIT, the resilience within the industry is being challenged. We have seen the demise of a number of sub-contractors during the past year and this has presented further challenges in the completion of projects.

- The unpredictable increase in the price of materials has had impact on the profitability of the project, and was exacerbated by the impacts of the Ukraine-Russian war which disrupted the trade routes with our suppliers leading to further delays and higher costs.",3552460.0,40,12002,Ukraine-Russian war,Interstate Conflict,disruption of trade routes with suppliers; delays in project completion; increase in procurement costs,,TRUE,"['Ukraine', 'Russia']","The war between Ukraine and Russia is disrupting trade routes with suppliers, leading to further delays and higher costs.",CV1 4PB,Coventry,West Midlands,https://find-and-update.company-information.service.gov.uk/company/09961909/filing-history/MzQxNjYyNzM2OGFkaXF6a2N4/document?format=xhtml&download=0,2024-03-29
SHEFFIELD METALLURGICAL AND ENGINEERING ASSOCIATION,2830671,['94120'],Other Service Activities,4343,5213,['Activities of professional membership organisations'],Prod223_3666_02830671_20230630,"SMEA continued to support Sheffield Museums Industrial Trust. Educational initiatives included awarding Student Prizes and the early careers focused Professional Development Fund.
Income from the Association's investment portfolio remained strong, but capital reduced due to global economic conditions resulting from the war in Ukraine and high inflation. A close working relationship has continued with Investec Wealth Management.
Financial review
The results for the year are shown in the subsequent pages of the financial statements. The trustees consider the financial position to be satisfactory.
Principal funding sources
The charitable company derives most of its income from listed investments and from its subsidiary company SMEA Events Limited. The whole of the profits of this company are remitted annually to SMEA under the Gift Aid scheme.
Investment policy",,0,5755,war in Ukraine,Interstate Conflict,reduced capital due to global economic conditions; high inflation,,TRUE,['Ukraine'],The war in Ukraine is directly contributing to adverse global economic conditions.,S11 9FL,Sheffield,Yorkshire and The Humber,https://find-and-update.company-information.service.gov.uk/company/02830671/filing-history/MzQxNjYyMjA0MGFkaXF6a2N4/document?format=xhtml&download=0,2024-03-29
BPS WARWICK LIMITED,9300364,['70100'],"Professional, Scientific and Technical Activities",3180,4020,['Activities of head offices'],Prod223_3666_09300364_20230630,"The Group’s sectors continued to experience the economic challenges post Covid and from the impact of the Ukraine war on supply chain efficiency and pricing. Timber pricing remained particularly volatile with other key costs subject to inflation, particularly fuel, power and wages. Consumer demand was tempered by the cost of living crisis and rising Bank of England Base Rates. As a result of the overall outlook for the Group, the Group boards instigated a strategic review to identify opportunity to improve the customer offering and service, replacing and streamlining product ranges. New software was introduced to improve efficiency and responsiveness as well as control and reporting. The Group continue to prioritise providing a good working environment for its valued staff, investing in skills development and career progression,",6381979.0,148,34023,Impact of the Ukraine war on supply chain efficiency and pricing,Interstate Conflict,"volatility in timber pricing due to supply chain disruptions; increase in other key costs due to inflation - particularly fuel, power and wages",,TRUE,['Ukraine'],The war in Ukraine has negatively affected the supply chain and pricing efficiency of the group,CV34 6RH,Leamington Spa,West Midlands,https://find-and-update.company-information.service.gov.uk/company/09300364/filing-history/MzQxNjYyMDE3NGFkaXF6a2N4/document?format=xhtml&download=0,2024-03-29
STRATHMORE LEISURE LIMITED,SC598864,['55100'],Accommodation and Food Service Activities,973,1876,['Hotels and similar accommodation'],Prod223_3666_SC598864_20221231,"2022 saw a continuation of increasing costs due to the War in Ukraine pushing energy costs upwards. Continued supply chain issues also saw significant inflationary pressures and by extension interest rate increases. However due to Strathmore Hotels historic strategy of only operating units within key tourist and conference locations the group was, and is, always placed well to recover swiftly from any forced restriction on trade. In turn, the group has always maintained prudence and risk aversion in terms of borrowing so low Loan to Value (""LTV"") have always been maintained. This, coupled with shift away in 2014 in relying on fossil fuels as it’s primary energy source, means that, although the group has experienced significant increases in costs – the group is as well placed as any other to cope, and absorb, such increasing cost pressures.
Principal risks and uncertainties
Operating Climate",9880253.0,1,33703,The War in Ukraine,Interstate Conflict,Increased energy costs; Increased supply chain issues; Increased cost of operations; Inflationary pressures; Interest rate increases,,TRUE,['Ukraine'],The War in Ukraine has led to increased energy costs and supply chain issues.,G74 1LF,East Kilbride,Scotland,https://find-and-update.company-information.service.gov.uk/company/SC598864/filing-history/MzQxNjYyMzEwNmFkaXF6a2N4/document?format=xhtml&download=0,2024-03-29
BUILDING AND PLUMBING SUPPLIES LIMITED,288407,['46130'],Wholesale and Retail Trade; Repair of Motor Vehicles and Motorcycles,2942,3937,['Agents involved in the sale of timber and building materials'],Prod223_3666_00288407_20230630,"The period has seen continuing supply chain management impact and price volatility from the ongoing war in Ukraine, continuing fuel price volatility, 2 substantial national living wage rises, rising Bank of England Base Rate and these factors combining to cause a cost of living crisis for some, tempering demand from others. Considering the overall net trading loss despite strong margins and the overall business conditions at the end of the period as confirmed by BMF and other industry data, the board has instigated a strategic review. All aspects of the business have been subject to this review with a focus on maintaining high levels of customer service, providing optimal product ranges, replacing and streamlining where appropriate as well as introducing new software and reporting structures to support greater control, efficiency and responsiveness. The business continues to prioritise providing a good working environment for its valued staff enabling skills development and career",9653262.0,129,5942,ongoing war in Ukraine,Interstate Conflict,continuing supply chain management impact; price volatility; tempered demand due to cost of living crisis; overall net trading loss,,TRUE,['Ukraine'],"The ongoing war in Ukraine is causing supply chain disruptions and price volatility, presenting operational and financial risks.",CV34 6RH,Leamington Spa,West Midlands,https://find-and-update.company-information.service.gov.uk/company/00288407/filing-history/MzQxNjYyMDM1NGFkaXF6a2N4/document?format=xhtml&download=0,2024-03-29
JK TECH UK LIMITED,3812106,['62090'],[None],36524,37481,['Other information technology and computer service activities'],Prod223_3666_03812106_20230331,"There were no essential either adjusting events or non-adjusting events in the period of time elapsing between the balance sheet date and the date on which these financial statements are prepared.The directors have also confirmed that the business will continue to be a going concern for the foreseeable future and they will support the company.
The Ongoing Russia – Ukraine conflict
This ongoing Russia - Ukraine conflict has resulted in going concern becoming a significant risk. The United States and Europe have avoided direct military conflict with Russia amid its conflict with Ukraine. They have however used a set of financial sanctions to limit Russia's access to financial resources. The impact of the sanctions may result in difficulties for the company to operate.Neither JK Tech UK Limited nor the owners are currently on the sanctions list at the time of this report, however this may change as the situation changes.
13 Contingent liabilities",637543.0,13,11956,Ongoing Russia - Ukraine conflict,Interstate Conflict,company's operation difficulties due to financial sanctions; possible inclusion in the sanction list in the future,,TRUE,"['Russia', 'Ukraine', 'United States of America']","The ongoing conflict between Russia and Ukraine has imposed significant financial risk. This is due to the financial sanctions placed on Russia by Europe and the United States. These sanctions limit Russia's access to financial resources, which can create operational difficulties for businesses interacting with Russia.",W1W 7LT,London,London,https://find-and-update.company-information.service.gov.uk/company/03812106/filing-history/MzQxNjY0NTEwOGFkaXF6a2N4/document?format=xhtml&download=0,2024-03-29
GREEKBEAT RADIO LIMITED,10265190,['73120'],"Professional, Scientific and Technical Activities",8404,9342,['Media representation'],Prod223_3666_10265190_20230331,"11. EVENTS AFTER THE REPORTING PERIOD

There were no essential either adjusting events or non-adjusting events in the period of time elapsing between the balance sheet date and the date on which these financial statements are prepared. The impact of COVID-19 is described in the Going Concern Consideration Note.
The ongoing Russia-Ukraine conflict has resulted in going concern becoming a significant risk. The United States and Europe have avoided direct military conflict with Russia amid its conflict with Ukraine. They have however used a set of financial sanctions to limit Russia's access to financial resources. The impact of the sanctions may result in difficulties for the company to operate. Neither Greekbeat Radio Limited nor the owners are currently on the sanctions list at the time of this report, however this may change as the situation changes.

Page 5 continued...
Greekbeat Radio Limited (Registered number: 10265190)",17541.0,1,22831,ongoing Russia-Ukraine conflict,Interstate Conflict,going concern risk; potential difficulties for the company to operate; possibility of company or its owners ending up on sanctions list,,TRUE,"['Russia', 'Ukraine', 'United States of America']",The ongoing conflict between Russia and Ukraine presents a significant risk due to the financial sanctions imposed by the United States. These geo-political tensions could impact the stability of the company's operations and its future financial performance.,,Potters Bar,,https://find-and-update.company-information.service.gov.uk/company/10265190/filing-history/MzQxNjU5OTQzM2FkaXF6a2N4/document?format=xhtml&download=0,2024-03-29
JK TECH UK LIMITED,3812106,['62090'],[None],1597,2589,['Other information technology and computer service activities'],Prod223_3666_03812106_20230331,"a.This ongoing Russia - Ukraine conflict has resulted in going concern becoming a significant risk. The United States and Europe have avoided direct military conflict with Russia amid its conflict with Ukraine. They have however used a set of financial sanctions to limit Russia's access to financial resources. The impact of the sanctions may result in difficulties for the company to operate. Neither JK Tech UK Limited nor the owners are currently on the sanctions list at the time of this report, however this may change as the situation changes.
b. Financial risk management objectives and policies of the company including the policy for hedging each major type of forecasted transaction for which hedge accounting is used ;and
c. The exposure of the company to price risk,credit risk,liquidity risk and cash flow risk;unless such information is not material for the assessment of the assets ,liabilities,financial position and profit or loss of the company.
Directors' responsibilities",637543.0,13,11911,ongoing Russia - Ukraine conflict,Interstate Conflict,significant going concern risk; potential inclusion on sanctions list affecting operations,,TRUE,"['Russia', 'Ukraine', 'United States of America']",The ongoing conflict between Russia and Ukraine is causing significant concern and potential operational difficulties for the company due to imposed financial sanctions.,W1W 7LT,London,London,https://find-and-update.company-information.service.gov.uk/company/03812106/filing-history/MzQxNjY0NTEwOGFkaXF6a2N4/document?format=xhtml&download=0,2024-03-29
HBS GROUP SOUTHERN LTD,2104036,['43220'],Construction,28117,28934,"['Plumbing, heat and air-conditioning installation']",Prod223_3666_02104036_20230331,"Page 15 continued...
HBS GROUP SOUTHERN LTD (REGISTERED NUMBER: 02104036)

NOTES TO THE FINANCIAL STATEMENTS - continued
FOR THE YEAR ENDED 31 MARCH 2023


2. ACCOUNTING POLICIES - continued

Going concern
The company's operational and risk management strategies are outlined in detail within the strategic and directors report. Presently, the company fulfills its day-to-day working capital needs through its banking arrangements with the Bank of Scotland.

The construction sector, alongside broader economic conditions, faces ongoing challenges stemming from the enduring effects of the pandemic, Brexit, the conflict in Ukraine, inflationary pressures, rising interest rates, and the energy crisis. These factors exert considerable influence on industry dynamics and consequently impact the company's performance.",5603174.0,78,27914,Conflict in Ukraine impacting the construction industry,Interstate Conflict,Altered industry dynamics; Negative impacts on company performance,,TRUE,['Ukraine'],The conflict in Ukraine is stated to impact the construction industry by exerting considerable influence on industry dynamics. This can have significant effects on a company's performance in the construction sector.,PO15 7FE,Whiteley,South East,https://find-and-update.company-information.service.gov.uk/company/02104036/filing-history/MzQxNjYzMDMxNmFkaXF6a2N4/document?format=xhtml&download=0,2024-03-29
HEALY GROUP LIMITED,8404317,['42990'],Construction,4449,5447,['Construction of other civil engineering projects nec'],Prod223_3666_08404317_20230630,"PRINCIPAL RISKS AND UNCERTAINTIES
The group's trading operations could be affected by a number of external factors that may pose a risk to its financial performance in the short, medium and long term which are: -

1. A significant downturn within the construction industry from external factors that are beyond the control of the group.

1. Uncapped price rises of general building materials resulted from supply and demand issues in particular as a result of continued global instability and conflict.

2. A change in Government following the imminent General Election which may result in a withdrawal of support for Stamp Duty Relief for first time buyers or changes to policies which support Housing Associations.

The directors continue to monitor the market conditions and meet regularly to discuss any foreseeable circumstances that may necessitate a change to the group's strategy in order to mitigate the business exposure to changes within the working environment.

ON BEHALF OF THE BOARD:",1924258.0,57,2805,Global instability and conflict,Interstate Conflict,Increased cost due to rise in prices of building materials; Uncapped price rises of building materials,,TRUE,[],,B98 9HL,Redditch,West Midlands,https://find-and-update.company-information.service.gov.uk/company/08404317/filing-history/MzQxNjYxNzA5N2FkaXF6a2N4/document?format=xhtml&download=0,2024-03-29
HADDEN CONSTRUCTION LIMITED,SC141875,"['41100', '41201', '41202']",Construction,3352,4334,"['Development of building projects', 'Construction of commercial buildings', 'Construction of domestic buildings']",Prod223_3666_SC141875_20230331,"We continually look for operational efficiencies and productivity improvements across the business with effective use of our ongoing investment in processes, Quality Management, strong Health and Safety and Project Management software.
 We remain committed to our corporate responsibility to reduce our environmental footprint, working closely with our partners to integrate sustainability in all areas of our business.
 Principal risks and uncertainties
The risks facing the company are those for the construction industry generally, such as ongoing price inflation for our materials; labour and skills shortage and the ongoing impact of budget restrictions following the pandemic. Other risks affecting the business include upward pressure on wages and salaries due to the cost-of-living crisis, rising utility costs following Russia’s invasion of Ukraine, increasing regulatory burdens on construction and UK interest rate rises, adversely affecting activity across the industry.",3512419.0,90,23286,Russia's invasion of Ukraine,Interstate Conflict,upward pressure on wages and salaries; increased operating costs due to rising utility costs,,TRUE,"['Russia','Ukraine', 'UK']","The risk mentions rising utility costs potentially caused by Russia's invasion of Ukraine. Therefore, the conflict between these two countries is relevant to utility costs.",PH3 1EL,Perthshire,Scotland,https://find-and-update.company-information.service.gov.uk/company/SC141875/filing-history/MzQxNjYyMTcxOGFkaXF6a2N4/document?format=xhtml&download=0,2024-03-29
HIGH ROAD RESTAURANTS GROUP HOLDCO LIMITED,10482231,['64209'],Financial and Insurance Activities,3160,4112,"['Activities of other holding companies (not including agricultural, production, construction, distribution and financial services holding companies) nec']",Prod223_3666_10482231_20230625,"The invasion of Ukraine, supply led inflation and continued increases in interest rates has negatively impacted the mood of the consumer. This was felt earlier on the south coast and as of Summer 2023 was also being felt by some of the regional BA sites.
Page 2
  High Road Restaurants Group Holdco Limited
Strategic Report
period from 27 June 2022 to 25 June 2023
Financial performance
During the period ended 25 June 2023, the group generated sales from restaurant activities of £13.58m (2022 - £10.75m) generating an operating loss of £1m (2022 – operating profit of £0.3m), and a loss before tax of £2.7m (2022 - £0.9m).

During the period ended 25 June 2023, the group generated negative EBITDA of £443,957 (2022 - positive EBITDA of £829,884).

Non-cash adjustments during the period were as follows:

Notional interest on non-market rate loans: £160,999 (2022 - £784,915)

Capitalised interest on market rate loans: £1,415,247 (2022 - £421,063l)",3811844.0,312,35915,invasion of Ukraine,Interstate Conflict,Negative consumer mood,,TRUE,['Ukraine'],The invasion of Ukraine is noted to have negatively impacted the consumer mood.,RH4 3BX,Dorking,South East,https://find-and-update.company-information.service.gov.uk/company/10482231/filing-history/MzQxNjYyNjU3NmFkaXF6a2N4/document?format=xhtml&download=0,2024-03-29
ARMATILE LIMITED,NI018558,['47530'],Wholesale and Retail Trade; Repair of Motor Vehicles and Motorcycles,1806,2620,"['Retail sale of carpets, rugs, wall and floor coverings in specialised stores']",Prod223_3666_NI018558_20230630,"The company is committed to achieving the highest possible standards in health and safety management and strives to make all our premises safe environments for employees and customers.
Principal risks and uncertainties
The core risks associated with the company's operations are identified below.
Events in Ukraine and Gaza
The current events in Ukraine and Gaza are leading to an unprecedented increase in energy and raw material costs, and uncertainty in global economic outlook. The costs of all components of ceramic production, namely gas, electricity, clay, glazing, packaging, and transport have stabilised, however they remain volatile. The full impact of these increases on our trade is difficult to quantify at this stage and the situation will be constantly reviewed by management.
Foreign exchange risk",7629081.0,86,6243,Current events in Ukraine and Gaza,Interstate Conflict,"Increased energy and raw material costs; Uncertainty in global economic outlook; Volatile cost of production components namely gas, electricity, clay, glazing, packaging, and transport",,TRUE,"['Ukraine', 'Palestine']","The current events in Ukraine and Gaza (a territory in Palestine) are leading to an unprecedented increase in energy and raw material costs, and uncertainty in the global economic outlook.",BT61 7NP,Armagh,Northern Ireland,https://find-and-update.company-information.service.gov.uk/company/NI018558/filing-history/MzQxNjYwNzY3OGFkaXF6a2N4/document?format=xhtml&download=0,2024-03-29
